{
  "name": "huginn",
  "version": "1.0.0",
  "description": "Odin's raven gathers knowledge: YouTube transcript extraction with 3-tier fallback and video downloading with quality presets, playlist/channel support, and batch processing",
  "author": {
    "name": "AltaKleos Platform Team",
    "email": "hello@altakleos.com"
  }
}
