{
  "name": "example-plugin",
  "version": "1.0.0",
  "description": "Example plugin demonstrating Claude Code plugin structure and best practices",
  "author": {
    "name": "AltaKleos Platform Team",
    "email": "admin@altakleos.com"
  },
  "keywords": ["example", "demo", "tutorial"],
  "category": "productivity",
  "license": "MIT"
}
