{
  "name": "quickstart",
  "version": "1.1.1",
  "description": "Intelligent skill factory that creates precisely optimized Claude Code extensions (skills, agents, suites, or hybrid solutions) through deep contextual understanding and adaptive intelligence",
  "author": {
    "name": "AltaKleos Platform Team",
    "email": "hello@altakleos.com"
  }
}
